{
  "apiVersion": "platform.release/v1",
  "kind": "Release",
  "metadata": {"application": "payment-api", "owner": "payment-team"},
  "spec": {
    "artifactDigest": "sha256:aaaaaaaaaaaaaaaaaaaaaaaaaaaaaaaaaaaaaaaaaaaaaaaaaaaaaaaaaaaaaaaa",
    "from": "test",
    "to": "prod",
    "releaseProfile": "canary/canary-v1",
    "changeReason": "Promote the tested payment-api artifact to production"
  }
}
